{
  "apiVersion": "edge.forms.takoform.com",
  "kind": "WorkerVersion",
  "definitionVersion": "0.3.0",
  "title": "Worker Version",
  "description": "Immutable executable snapshot of one Module Worker: a bundle, the handlers its module exports, non-secret vars, and the typed capability bindings the code may use. A change is a new Worker Version; traffic moves only through Worker Deployments. The runtime this code runs on is not a field of this Form: it is fixed by the worker.runtime@1.1.0 contract the Module Worker identity provides, so a version carries no compatibility date and no compatibility flag (decision 0019).",
  "role": "revision",
  "requiresHostApi": "forms.takoform.com/v1",
  "desiredSchema": {
    "$defs": {
      "jsonValueDepth1": {
        "additionalProperties": {
          "$ref": "#/$defs/jsonValueDepth2"
        },
        "items": {
          "$ref": "#/$defs/jsonValueDepth2"
        },
        "maxItems": 64,
        "maxLength": 8192,
        "maxProperties": 64,
        "propertyNames": {
          "pattern": "^[A-Za-z][A-Za-z0-9._-]{0,63}$",
          "type": "string",
          "x-takoform-fieldPolicy": "portable-data-only-v1"
        },
        "type": [
          "array",
          "boolean",
          "null",
          "number",
          "object",
          "string"
        ]
      },
      "jsonValueDepth2": {
        "additionalProperties": {
          "$ref": "#/$defs/jsonValueDepth3"
        },
        "items": {
          "$ref": "#/$defs/jsonValueDepth3"
        },
        "maxItems": 64,
        "maxLength": 8192,
        "maxProperties": 64,
        "propertyNames": {
          "pattern": "^[A-Za-z][A-Za-z0-9._-]{0,63}$",
          "type": "string",
          "x-takoform-fieldPolicy": "portable-data-only-v1"
        },
        "type": [
          "array",
          "boolean",
          "null",
          "number",
          "object",
          "string"
        ]
      },
      "jsonValueDepth3": {
        "additionalProperties": {
          "$ref": "#/$defs/jsonValueDepth4"
        },
        "items": {
          "$ref": "#/$defs/jsonValueDepth4"
        },
        "maxItems": 64,
        "maxLength": 8192,
        "maxProperties": 64,
        "propertyNames": {
          "pattern": "^[A-Za-z][A-Za-z0-9._-]{0,63}$",
          "type": "string",
          "x-takoform-fieldPolicy": "portable-data-only-v1"
        },
        "type": [
          "array",
          "boolean",
          "null",
          "number",
          "object",
          "string"
        ]
      },
      "jsonValueDepth4": {
        "additionalProperties": {
          "$ref": "#/$defs/jsonValueDepth5"
        },
        "items": {
          "$ref": "#/$defs/jsonValueDepth5"
        },
        "maxItems": 64,
        "maxLength": 8192,
        "maxProperties": 64,
        "propertyNames": {
          "pattern": "^[A-Za-z][A-Za-z0-9._-]{0,63}$",
          "type": "string",
          "x-takoform-fieldPolicy": "portable-data-only-v1"
        },
        "type": [
          "array",
          "boolean",
          "null",
          "number",
          "object",
          "string"
        ]
      },
      "jsonValueDepth5": {
        "additionalProperties": {
          "$ref": "#/$defs/jsonValueDepth6"
        },
        "items": {
          "$ref": "#/$defs/jsonValueDepth6"
        },
        "maxItems": 64,
        "maxLength": 8192,
        "maxProperties": 64,
        "propertyNames": {
          "pattern": "^[A-Za-z][A-Za-z0-9._-]{0,63}$",
          "type": "string",
          "x-takoform-fieldPolicy": "portable-data-only-v1"
        },
        "type": [
          "array",
          "boolean",
          "null",
          "number",
          "object",
          "string"
        ]
      },
      "jsonValueDepth6": {
        "additionalProperties": {
          "$ref": "#/$defs/jsonValueDepth7"
        },
        "items": {
          "$ref": "#/$defs/jsonValueDepth7"
        },
        "maxItems": 64,
        "maxLength": 8192,
        "maxProperties": 64,
        "propertyNames": {
          "pattern": "^[A-Za-z][A-Za-z0-9._-]{0,63}$",
          "type": "string",
          "x-takoform-fieldPolicy": "portable-data-only-v1"
        },
        "type": [
          "array",
          "boolean",
          "null",
          "number",
          "object",
          "string"
        ]
      },
      "jsonValueDepth7": {
        "additionalProperties": {
          "$ref": "#/$defs/jsonValueDepth8"
        },
        "items": {
          "$ref": "#/$defs/jsonValueDepth8"
        },
        "maxItems": 64,
        "maxLength": 8192,
        "maxProperties": 64,
        "propertyNames": {
          "pattern": "^[A-Za-z][A-Za-z0-9._-]{0,63}$",
          "type": "string",
          "x-takoform-fieldPolicy": "portable-data-only-v1"
        },
        "type": [
          "array",
          "boolean",
          "null",
          "number",
          "object",
          "string"
        ]
      },
      "jsonValueDepth8": {
        "maxLength": 8192,
        "type": [
          "boolean",
          "null",
          "number",
          "string"
        ]
      }
    },
    "$schema": "https://json-schema.org/draft/2020-12/schema",
    "additionalProperties": false,
    "description": "Immutable executable snapshot of one Module Worker: a bundle, the handlers its module exports, non-secret vars, and the typed capability bindings the code may use. A change is a new Worker Version; traffic moves only through Worker Deployments. The runtime this code runs on is not a field of this Form: it is fixed by the worker.runtime@1.1.0 contract the Module Worker identity provides, so a version carries no compatibility date and no compatibility flag (decision 0019).",
    "properties": {
      "actorBindings": {
        "default": [],
        "description": "Typed module-worker.actor bindings projecting addressing and invocation — idFromName, newUniqueId, get. Omitting it declares no such binding.",
        "items": {
          "additionalProperties": false,
          "properties": {
            "name": {
              "maxLength": 64,
              "pattern": "^[A-Za-z_$][A-Za-z0-9_$]*$",
              "type": "string"
            },
            "resource": {
              "additionalProperties": false,
              "properties": {
                "apiVersion": {
                  "const": "edge.forms.takoform.com",
                  "type": "string"
                },
                "kind": {
                  "const": "ActorNamespace",
                  "type": "string"
                },
                "name": {
                  "maxLength": 63,
                  "minLength": 1,
                  "pattern": "^[a-z]([a-z0-9-]{0,61}[a-z0-9])?$",
                  "type": "string"
                }
              },
              "required": [
                "apiVersion",
                "kind",
                "name"
              ],
              "type": "object",
              "x-takoform-required-interface": {
                "apiVersion": "interfaces.takoform.com/v1alpha1",
                "name": "worker.actor",
                "schemaDigest": "sha256:f5428fb587de80261dd7363dc5b8a3f4aab7e469fa1b5fce8441ad9acbec8218",
                "version": "1.0.0"
              }
            }
          },
          "required": [
            "name",
            "resource"
          ],
          "type": "object"
        },
        "maxItems": 64,
        "type": "array",
        "uniqueItems": true,
        "x-takoform-binding": "module-worker.actor"
      },
      "assets": {
        "additionalProperties": false,
        "description": "Optional static-asset attachment for this immutable version. Without it the host performs no asset lookup. When present, every member is required and the request order is closed: with runWorkerFirst=false the host tries the asset lookup before invoking fetch; with true it invokes fetch first and tries the asset lookup only when that invocation returns 404. An asset result wins; if both stages miss, the worker's 404 is preserved. The attachment never grants a hidden runtime binding and never mutates the referenced bundle.",
        "properties": {
          "bundle": {
            "additionalProperties": false,
            "description": "Static Asset Bundle whose exact manifest inventory this version serves.",
            "properties": {
              "apiVersion": {
                "const": "edge.forms.takoform.com",
                "type": "string"
              },
              "kind": {
                "const": "StaticAssetBundle",
                "type": "string"
              },
              "name": {
                "maxLength": 63,
                "minLength": 1,
                "pattern": "^[a-z]([a-z0-9-]{0,61}[a-z0-9])?$",
                "type": "string"
              }
            },
            "required": [
              "apiVersion",
              "kind",
              "name"
            ],
            "type": "object",
            "x-takoform-target-formrefs": [
              {
                "apiVersion": "edge.forms.takoform.com",
                "definitionVersion": "0.1.0",
                "kind": "StaticAssetBundle",
                "schemaDigest": "sha256:83142a3f824cf1fa2793fb73f4c32203ae07fb70db789d056aebe4c0ebe9334f"
              }
            ]
          },
          "notFoundHandling": {
            "description": "Closed asset-miss behavior. none leaves a missing exact path as a miss. single_page_application serves the bundle's index.html for a missing path; a bundle without index.html is refused before this Worker Version is stored.",
            "enum": [
              "none",
              "single_page_application"
            ],
            "type": "string"
          },
          "runWorkerFirst": {